Date,Source,Flag,Category,Target,Title,URL,Summary
2026-04-20,QuantumInsider,,,,Kvantify and Equal1 Partner on Quantum Computing Integration,https://thequantuminsider.com/2026/04/20/kvantify-equal1-quantum-partnership/,"Insider Brief PRESS RELEASE — Kvantify and Equal1 are pleased to announce the formation of a strategic alliance aimed at delivering integrated, high-performance quantum computing solutions. By combining their respective technologies and expertise, the two companies will address some of the world’s m"
2026-04-20,QuantumInsider,,,,"Quantum Matters: AI and Quantum Converge as Risks, Regulation and Energy Constraints Mount",https://thequantuminsider.com/2026/04/20/quantum-matters-ai-risks/,"Guest Post by Karina Robinson What does a lawyer in 1980s Italy have in common with uber-scientist John von Neumann? With the Red Brigades killing politicians and judges with impunity in 1980s Italy, a prosecuting magistrate’s decision to persevere in a terrorist investigation amounts to a death wis"
2026-04-20,QuantumInsider,,,,New Model Explains How Single Electrons Cause Damage Inside Silicon Chips,https://thequantuminsider.com/2026/04/20/new-model-explains-how-single-electrons-cause-damage-inside-silicon-chips/,"Insider Brief PRESS RELEASE — Researchers in the UC Santa Barbara Materials Department have uncovered the elusive quantum mechanism by which energetic electrons break chemical bonds inside microelectronic devices — a detrimental process that slowly degrades performance over time. The discovery, publ"
2026-04-20,QuantumInsider,,,,Quantum Myths vs Reality – Understanding Where the Technology Stands,https://thequantuminsider.com/2026/04/20/quantum-myths-vs-reality-understanding-technology/,"Insider Brief The majority of the readers encountering quantum computing through headlines come away with one of two impressions. Either a machine somewhere is about to break every password on the internet, or the whole thing is overhyped nonsense that will never leave the lab. Both views are wrong,"
2026-04-20,IonQ,,,,Quantum computingCommercial quantum computers with world-record fidelity to tackle the world’s most complex challenges.,https://ionq.com/quantum-systems/compare,
2026-04-20,IonQ,,,,Quantum networkingSecuring communications and building the global quantum internet.,https://ionq.com/full-stack-platform#quantum-networking,
2026-04-20,IonQ,,,,Quantum securityProtecting critical data from current and future threats.,https://ionq.com/full-stack-platform#quantum-security,
2026-04-20,IonQ,,,,"Quantum sensingUltra precise and accurate sensing that advances navigation, imaging, and resource discovery.",https://ionq.com/full-stack-platform#quantum-sensing,
2026-04-20,IonQ,,,,Quantum space infrastructureCreating a secure space-based platform to protect the data of governments and enterprises.,https://ionq.com/full-stack-platform#quantum-space-infrastructure,
