Date,Flag,Category,Source,Target,Title,URL,Summary,Summary_X
2026-04-16T17:57:08Z,,Paper,arXiv,,Super-Constant Weight Dicke States in Constant Depth Without Fanout,https://arxiv.org/abs/2604.15298v1,"An $n$-qubit Dicke state of weight $k$, is the uniform superposition over all $n$-bit strings of Hamming weight $k$. Dicke states are an entanglement resource with important practical applications in the NISQ era and, for instance, play a central role in Decoded Quantum Interferometry (DQI). Further",
2026-04-16T16:44:35Z,,Paper,arXiv,,Simulation of quantum annealing on a semiconducting cQED device for Multiple Hypothesis Tracking (MHT) benchmark,https://arxiv.org/abs/2604.15213v1,We explore the expected performance of a semiconducting spin cQED quantum processor for Multiple Hypothesis Tracking (MHT) algorithm via a quantum annealing procedure. From two different benchmarking scenarios we evaluate this type of quantum annealer on a quantum emulator in which we incorporated b,
2026-04-16T16:40:43Z,,Paper,arXiv,,Variational quantum state preparation within an entangle-rotate circuit framework for quantum-enhanced metrology in noisy systems,https://arxiv.org/abs/2604.15209v1,We investigate the generation of quantum states for precision metrology in noisy two-level systems. These states are obtained by optimizing a variational quantum circuit to maximize the quantum Fisher information (QFI) of the output state for a given decoherence rate and interaction Hamiltonian. The,
2026-04-16T15:59:50Z,,Paper,arXiv,,Quantum Metropolis-Hastings via Penalised Qubitized Walks: Spectral Filtering and Circuit Implementation,https://arxiv.org/abs/2604.15179v1,"The Metropolis-Hastings algorithm is a cornerstone of Markov Chain Monte Carlo methods, underpinning a wide range of applications in computational physics, Bayesian inference, and machine learning. Quantum variants of Metropolis-Hastings promise accelerated mixing through quantum walks, but their pr",
2026-04-16T15:04:53Z,,Paper,arXiv,,Constraints on phantom codes from automorphism group bounds,https://arxiv.org/abs/2604.15111v1,"Executing a logical quantum circuit fault-tolerantly incurs a large spacetime overhead. Recent work has proposed and investigated phantom codes, defined by the property that every in-block logical $\mathrm{CNOT}$ circuit can be implemented with a physical permutation, a property that has the potenti",
